{
    "$schema": "https://schema.streamr.network/config-v2.schema.json",
    "client": {
        "auth": {
            "privateKey": "0x2ba0e218041e81b8e5c88ee4134995c1e358c2c01664676d975792057c57e333"
        },
        "network": {
            "id": "0xde3331cA6B8B636E0b82Bf08E941F727B8927442",
            "trackers": {
                "contractAddress": "0xBFCF120a8fD17670536f1B27D9737B775b2FD4CF"
            },
            "location": {
                "latitude": 47.16,
                "longitude": 8.51,
                "country": "Switzerland",
                "city": "Zug"
            },
            "webrtcDisallowPrivateAddresses": false
        },
        "theGraphUrl": "http://10.200.10.1:8000/subgraphs/name/streamr-dev/network-contracts",
        "streamRegistryChainAddress": "0x6cCdd5d866ea766f6DF5965aA98DeCCD629ff222",
        "streamStorageRegistryChainAddress": "0xd04af489677001444280366Dd0885B03dAaDe71D",
        "storageNodeRegistryChainAddress": "0x231b810D98702782963472e1D60a25496999E75D",
        "streamRegistryChainRPCs": {
            "chainId": 8995,
            "rpcs": [
                {
                    "url": "http://10.200.10.1:8546"
                }
            ]
        },
        "mainChainRPCs": {
            "chainId": 8995,
            "rpcs": [
                {
                    "url": "http://10.200.10.1:8545"
                }
            ]
        },
        "maxRetries": 2
    },
    "httpServer": {
        "port": 8691
    },
    "apiAuthentication": null,
    "plugins": {
        "consoleMetrics": {
            "interval": 30
        },
        "info": {}
    }
}
