{
    "$schema": "https://schema.streamr.network/config-v2.schema.json",
    "client": {
        "auth": {
            "privateKey": "0xaa7a3b3bb9b4a662e756e978ad8c6464412e7eef1b871f19e5120d4747bce966"
        },
        "network": {
            "id": "0xde1112f631486CfC759A50196853011528bC5FA0",
            "trackers": [
                {
                    "id": "0xb9e7cEBF7b03AE26458E32a059488386b05798e8",
                    "ws": "ws://127.0.0.1:30301",
                    "http": "http://127.0.0.1:30301"
                },
                {
                    "id": "0x0540A3e144cdD81F402e7772C76a5808B71d2d30",
                    "ws": "ws://127.0.0.1:30302",
                    "http": "http://127.0.0.1:30302"
                },
                {
                    "id": "0xf2C195bE194a2C91e93Eacb1d6d55a00552a85E2",
                    "ws": "ws://127.0.0.1:30303",
                    "http": "http://127.0.0.1:30303"
                }
            ],
            "location": {
                "latitude": 60.19,
                "longitude": 24.95,
                "country": "Finland",
                "city": "Helsinki"
            },
            "webrtcDisallowPrivateAddresses": false
        },
        "theGraphUrl": "http://10.200.10.1:8000/subgraphs/name/streamr-dev/network-contracts",
        "streamRegistryChainAddress": "0x6cCdd5d866ea766f6DF5965aA98DeCCD629ff222",
        "streamStorageRegistryChainAddress": "0xd04af489677001444280366Dd0885B03dAaDe71D",
        "storageNodeRegistryChainAddress": "0x231b810D98702782963472e1D60a25496999E75D",
        "streamRegistryChainRPCs": {
            "chainId": 8995,
            "rpcs": [
                {
                    "url": "http://10.200.10.1:8546"
                }
            ]
        },
        "mainChainRPCs": {
            "chainId": 8995,
            "rpcs": [
                {
                    "url": "http://10.200.10.1:8545"
                }
            ]
        },
        "maxRetries": 2
    },
    "httpServer": {
        "port": 8891
    },
    "apiAuthentication": null,
    "plugins": {
        "storage": {
            "cassandra": {
                "hosts": [
                    "127.0.0.1"
                ],
                "username": "",
                "password": "",
                "keyspace": "streamr_dev_v2",
                "datacenter": "datacenter1"
            },
            "storageConfig": {
                "refreshInterval": 10000
            }
        }
    }
}
